{
  "content_policy": "dcrypt-v4-assurance-profile-v1",
  "evidence": {
    "lab_report_sha256": "5beedc41fd92d9a102b48fca2cacb53daf9c67eb12d7ad30a74af5593fb493a0",
    "manifest_sha256": "d4811b7bfcb42c3e3b9dde263d54bb949f24adf4a535e67a32fd57411c29db44",
    "manifest_signature": {
      "algorithm": "Ed25519",
      "external_identity_claimed": false,
      "verified": true
    },
    "threat_review": {
      "administratively_independent": false,
      "path": "assurance/release-lab/DAYBREAK-THREAT-REVIEW.md",
      "sha256": "a5751f12f40b7262467bc896789db94927c72fa99a6db8815557d0e6981b76a9",
      "type": "OpenAI-Daybreak-adversarial-review"
    }
  },
  "metrics": {
    "artifact_faults": {
      "classification": "calibrated-simulation",
      "detected": 432,
      "injected": 432,
      "model": "single-bit artifact mutation",
      "rate": 1.0
    },
    "historical_replay": {
      "classification": "measured-product-evidence",
      "ids": [
        "DCRYPT-2026-0001",
        "DCRYPT-2026-0002",
        "DCRYPT-2026-0003",
        "DCRYPT-2026-0004",
        "DCRYPT-2026-0005",
        "DCRYPT-2026-0006",
        "DCRYPT-2026-0007",
        "DCRYPT-2026-0008",
        "DCRYPT-2026-0009",
        "DCRYPT-2026-0010",
        "DCRYPT-2026-0011"
      ],
      "passed": 11,
      "total": 11
    },
    "leakage_calibration": {
      "classification": "calibrated-simulation",
      "model": "byte-hamming-weight-plus-seeded-gaussian-noise",
      "negative_control_abs_t": 0.6405812531942683,
      "positive_control_abs_t": 318.9296108607186,
      "samples_per_class": 20000,
      "threshold": 4.5
    },
    "packages": {
      "byte_equal": 12,
      "classification": "measured-product-evidence",
      "names": [
        "dcrypt-internal",
        "dcrypt-params",
        "dcrypt-api",
        "dcrypt-common",
        "dcrypt-algorithms",
        "dcrypt-symmetric",
        "dcrypt-kem",
        "dcrypt-sign",
        "dcrypt-pke",
        "dcrypt-utils",
        "dcrypt-hybrid",
        "dcrypt"
      ],
      "total": 12
    },
    "platforms": {
      "classification": "build-and-compiler-shape-evidence",
      "configured_targets": 4,
      "targets": [
        "x86_64-unknown-linux-gnu",
        "aarch64-unknown-linux-gnu",
        "wasm32-unknown-unknown",
        "thumbv7em-none-eabihf"
      ]
    },
    "sboms": {
      "classification": "measured-product-evidence",
      "deterministic": 5,
      "workspaces": [
        "bench",
        "fuzz",
        "migration",
        "production",
        "verification"
      ]
    },
    "standards": {
      "classification": "repository-corpus-correctness",
      "ml_dsa_cases": 615,
      "ml_kem_cases": 240,
      "provenance": "repository-byte-bound-corpus-upstream-acquisition-unverified",
      "total_cases": 855
    },
    "timing": {
      "blocking_cases": 29,
      "classification": "measured-product-evidence",
      "complete_passes": 2,
      "release_blocks": 0,
      "runs": [
        {
          "alpha": 0.01,
          "cases": [
            {
              "blocks_release": false,
              "ci_lower_ns": -89.584,
              "ci_upper_ns": 166.991,
              "exceeds_practical_threshold": true,
              "holm_reject": false,
              "mean_diff_ns": 37.984,
              "name": "AES-128",
              "practical_threshold_ns": 0.2,
              "primary_p_value": 0.44728553
            },
            {
              "blocks_release": false,
              "ci_lower_ns": -54.279,
              "ci_upper_ns": 12.666,
              "exceeds_practical_threshold": true,
              "holm_reject": false,
              "mean_diff_ns": -21.112,
              "name": "SHA-256",
              "practical_threshold_ns": 0.5,
              "primary_p_value": 0.10612894
            },
            {
              "blocks_release": false,
              "ci_lower_ns": -142.528,
              "ci_upper_ns": 106.113,
              "exceeds_practical_threshold": true,
              "holm_reject": false,
              "mean_diff_ns": -18.405,
              "name": "SHA3-256",
              "practical_threshold_ns": 0.5,
              "primary_p_value": 0.70740293
            },
            {
              "blocks_release": false,
              "ci_lower_ns": -110.563,
              "ci_upper_ns": 80.422,
              "exceeds_practical_threshold": true,
              "holm_reject": false,
              "mean_diff_ns": -13.289,
              "name": "HMAC-SHA256",
              "practical_threshold_ns": 0.5,
              "primary_p_value": 0.72641274
            },
            {
              "blocks_release": false,
              "ci_lower_ns": -11.845,
              "ci_upper_ns": 15.816,
              "exceeds_practical_threshold": true,
              "holm_reject": false,
              "mean_diff_ns": 2.06,
              "name": "ChaCha20",
              "practical_threshold_ns": 0.5,
              "primary_p_value": 0.70668293
            },
            {
              "blocks_release": false,
              "ci_lower_ns": -136.389,
              "ci_upper_ns": 68.347,
              "exceeds_practical_threshold": true,
              "holm_reject": false,
              "mean_diff_ns": -36.405,
              "name": "SHAKE-256",
              "practical_threshold_ns": 0.5,
              "primary_p_value": 0.36903631
            },
            {
              "blocks_release": false,
              "ci_lower_ns": -15.809,
              "ci_upper_ns": 25.979,
              "exceeds_practical_threshold": true,
              "holm_reject": false,
              "mean_diff_ns": 4.742,
              "name": "BLAKE3-XOF",
              "practical_threshold_ns": 0.5,
              "primary_p_value": 0.56870431
            },
            {
              "blocks_release": false,
              "ci_lower_ns": -148.784,
              "ci_upper_ns": 115.508,
              "exceeds_practical_threshold": true,
              "holm_reject": false,
              "mean_diff_ns": -18.101,
              "name": "HKDF",
              "practical_threshold_ns": 0.5,
              "primary_p_value": 0.72440276
            },
            {
              "blocks_release": false,
              "ci_lower_ns": -10611.282,
              "ci_upper_ns": 7027.405,
              "exceeds_practical_threshold": true,
              "holm_reject": false,
              "mean_diff_ns": -1296.212,
              "name": "PBKDF2",
              "practical_threshold_ns": 5.0,
              "primary_p_value": 0.71750282
            },
            {
              "blocks_release": false,
              "ci_lower_ns": -7563.789,
              "ci_upper_ns": 33921.567,
              "exceeds_practical_threshold": true,
              "holm_reject": false,
              "mean_diff_ns": 10135.122,
              "name": "Argon2id Verify",
              "practical_threshold_ns": 10.0,
              "primary_p_value": 0.24507755
            },
            {
              "blocks_release": false,
              "ci_lower_ns": -3.822,
              "ci_upper_ns": 1.778,
              "exceeds_practical_threshold": false,
              "holm_reject": false,
              "mean_diff_ns": -0.756,
              "name": "Argon2 Comparison",
              "practical_threshold_ns": 10.0,
              "primary_p_value": 0.52107479
            },
            {
              "blocks_release": false,
              "ci_lower_ns": 5.599,
              "ci_upper_ns": 569.646,
              "exceeds_practical_threshold": true,
              "holm_reject": false,
              "mean_diff_ns": 284.879,
              "name": "GCM Success Path",
              "practical_threshold_ns": 0.5,
              "primary_p_value": 0.01093989
            },
            {
              "blocks_release": false,
              "ci_lower_ns": -635.572,
              "ci_upper_ns": 197.866,
              "exceeds_practical_threshold": true,
              "holm_reject": false,
              "mean_diff_ns": -184.218,
              "name": "GCM Invalid Ciphertext Data",
              "practical_threshold_ns": 0.5,
              "primary_p_value": 0.27069729
            },
            {
              "blocks_release": false,
              "ci_lower_ns": -256.521,
              "ci_upper_ns": 454.08,
              "exceeds_practical_threshold": true,
              "holm_reject": false,
              "mean_diff_ns": 97.837,
              "name": "GCM First-vs-Last Tag Mismatch",
              "practical_threshold_ns": 0.5,
              "primary_p_value": 0.4800752
            },
            {
              "blocks_release": false,
              "ci_lower_ns": -44.59,
              "ci_upper_ns": 61.945,
              "exceeds_practical_threshold": true,
              "holm_reject": false,
              "mean_diff_ns": 8.634,
              "name": "ChaChaPoly Success Path",
              "practical_threshold_ns": 0.5,
              "primary_p_value": 0.67816322
            },
            {
              "blocks_release": false,
              "ci_lower_ns": -61.965,
              "ci_upper_ns": 45.053,
              "exceeds_practical_threshold": true,
              "holm_reject": false,
              "mean_diff_ns": -7.428,
              "name": "ChaChaPoly Invalid Ciphertext Data",
              "practical_threshold_ns": 0.5,
              "primary_p_value": 0.72572274
            },
            {
              "blocks_release": false,
              "ci_lower_ns": -32.689,
              "ci_upper_ns": 67.912,
              "exceeds_practical_threshold": true,
              "holm_reject": false,
              "mean_diff_ns": 18.926,
              "name": "ChaChaPoly First-vs-Last Tag Mismatch",
              "practical_threshold_ns": 0.5,
              "primary_p_value": 0.34168658
            },
            {
              "blocks_release": false,
              "ci_lower_ns": -2500.023,
              "ci_upper_ns": 7225.635,